{
	"$schema": "../../../schema/foundation.json",
	"name": "Account",
	"description": "Account",
	"tables": {
		"Account": {
			"description":""
		},
		"Cashflow": {
			"description":""
		},
		"Journal": {
			"description":""
		},
		"JournalLine": {
			"description":""
		},
		"JournalCashflow": {
			"description":""
		}
	},
	"joins" : [
		{
			"left":"",
			"right":"",
			"on":""
		},
		{
			"left":"",
			"right":"",
			"on":""
		}
	]
}